<?xml version="1.0" encoding="UTF-8"?>
<!DOCTYPE employees SYSTEM "employee.dtd">
<?xml-stylesheet type="text/xsl" href="employee.xsl"?>
<employees xmlns:xsi="http://www.w3.org/2001/XMLSchema-instance"
xsi:noNamespaceSchemaLocation="employee.xsd">
    <employee>
        <id>1</id>
        <name>Sakshi verma </name>
        <email>sakshi.verma@gmail.com</email>
        <position>Data Analyst</position>
        <department>Analytics</department>
        <salary>65000</salary>
        <joining_date>2022-11-20</joining_date>
        <age>28</age>
        <gender>Female</gender>
        <experience>4 years</experience>
    </employee>
    <employee>
        <id>2</id>
        <name>Virat Kohli</name>
        <email>virat.kohli@yahoo.com</email>
        <position>Data Scientist</position>
        <department>Analytics</department>
        <salary>65000</salary>
        <joining_date>2022-11-20</joining_date>
        <age>28</age>
        <gender>Male</gender>
        <experience>4 years</experience>
    </employee>
    <employee>
        <id>3</id>
        <name>John Doe</name>
        <email>john.doe@pict.edu.in</email>
        <position>Software Engineer</position>
        <department>IT</department>
        <salary>75000</salary>
        <joining_date>2023-01-15</joining_date>
        <age>30</age>
        <gender>Male</gender>
        <experience>5 years</experience>
    </employee>
    <employee>
        <id>4</id>
        <name>Jane Smith</name>
        <email>jane.smith@example.com</email>
        <position>Backend Developer</position>
        <department>IT</department>
        <salary>65000</salary>
        <joining_date>2022-11-20</joining_date>
        <age>28</age>
        <gender>Female</gender>
        <experience>4 years</experience>
    </employee>

    <employee>
        <id>5</id>
        <name>Aarav Sharma</name>
        <email>aarav.sharma@techcorp.com</email>
        <position>Senior Developer</position>
        <department>IT</department>
        <salary>95000</salary>
        <joining_date>2020-05-12</joining_date>
        <age>32</age>
        <gender>Male</gender>
        <experience>8 years</experience>
    </employee>
    <employee>
        <id>6</id>
        <name>Priya Iyer</name>
        <email>priya.iyer@analytics.io</email>
        <position>Data Scientist</position>
        <department>Analytics</department>
        <salary>88000</salary>
        <joining_date>2021-03-22</joining_date>
        <age>29</age>
        <gender>Female</gender>
        <experience>5 years</experience>
    </employee>
    <employee>
        <id>7</id>
        <name>Marcus Thorne</name>
        <email>m.thorne@enterprise.com</email>
        <position>Project Manager</position>
        <department>Operations</department>
        <salary>105000</salary>
        <joining_date>2019-11-01</joining_date>
        <age>40</age>
        <gender>Male</gender>
        <experience>15 years</experience>
    </employee>
    <employee>
        <id>8</id>
        <name>Elena Rodriguez</name>
        <email>elena.rodriguez@design.com</email>
        <position>UX Designer</position>
        <department>Creative</department>
        <salary>72000</salary>
        <joining_date>2022-08-15</joining_date>
        <age>26</age>
        <gender>Female</gender>
        <experience>3 years</experience>
    </employee>
    <employee>
        <id>9</id>
        <name>Liam Chen</name>
        <email>l.chen@fintech.net</email>
        <position>Financial Analyst</position>
        <department>Finance</department>
        <salary>82000</salary>
        <joining_date>2021-01-10</joining_date>
        <age>31</age>
        <gender>Male</gender>
        <experience>6 years</experience>
    </employee>
    <employee>
        <id>10</id>
        <name>Sarah Jenkins</name>
        <email>s.jenkins@hr-solutions.com</email>
        <position>HR Specialist</position>
        <department>Human Resources</department>
        <salary>68000</salary>
        <joining_date>2023-02-14</joining_date>
        <age>34</age>
        <gender>Female</gender>
        <experience>9 years</experience>
    </employee>
    <employee>
        <id>11</id>
        <name>Karan Malhotra</name>
        <email>k.malhotra@cloud.com</email>
        <position>DevOps Engineer</position>
        <department>IT</department>
        <salary>98000</salary>
        <joining_date>2021-06-30</joining_date>
        <age>28</age>
        <gender>Male</gender>
        <experience>5 years</experience>
    </employee>
    <employee>
        <id>12</id>
        <name>Aisha Khan</name>
        <email>aisha.k@marketing.com</email>
        <position>SEO Expert</position>
        <department>Marketing</department>
        <salary>62000</salary>
        <joining_date>2022-12-05</joining_date>
        <age>27</age>
        <gender>Female</gender>
        <experience>4 years</experience>
    </employee>
    <employee>
        <id>13</id>
        <name>David Miller</name>
        <email>d.miller@security.com</email>
        <position>Security Analyst</position>
        <department>IT</department>
        <salary>91000</salary>
        <joining_date>2020-09-18</joining_date>
        <age>35</age>
        <gender>Male</gender>
        <experience>10 years</experience>
    </employee>
    <employee>
        <id>14</id>
        <name>Sophie Dubois</name>
        <email>s.dubois@salesforce.fr</email>
        <position>Sales Executive</position>
        <department>Sales</department>
        <salary>55000</salary>
        <joining_date>2023-05-20</joining_date>
        <age>24</age>
        <gender>Female</gender>
        <experience>2 years</experience>
    </employee>
    
</employees>
